{"coverage":{"capture_status":"salvaged","reason":"existing_evidence_does_not_cover_all_runtime_boundaries","status":"INCOMPLETE"},"environment":"offline_fixture","freshness":{"derived_at":"2026-09-11T09:01:37.747657+00:00","reason":"copied_historical_evidence","source":"UNKNOWN"},"generated_at":"2026-09-11T09:01:37.747657+00:00","message_id":"mon1/2fbdba4f1f206b3527cdc0d3639c8f6c377a3bf25d35bc5d1039aeef4fb53c92","message_type":"monitoring.incidents","payload":{"available":1,"capture_ref":"historical-final","items":[{"actor":"observer","body":{"actor_action":"observer_rule_evaluation","affected_component":null,"affected_instrument":null,"affected_order":null,"capture_id":"historical-final","code":"SALVAGED_INCOMPLETE_EVIDENCE","delivery_state":"local_evidence_retained","end":null,"impact":"UNKNOWN","incident_id":"alert/e1d4d50dbea92cefda6df1a18fd148b3e236df4f7e05a673127001b42cf799e4","recovery":null,"related_events":["capture/historical-final"],"root_cause":"UNKNOWN","root_event":null,"rule_version":"alerts-1.0.0","scope_reason":"see_related_source_evidence","severity":"WARNING","start":null,"state":"OPEN","timestamp_reason":"source_labels_only_no_qualified_elapsed","trust":"INCOMPLETE"},"domain":"incident","identity":"alert/e1d4d50dbea92cefda6df1a18fd148b3e236df4f7e05a673127001b42cf799e4","observed_at_ns":"1789117293605921700","previous_sha256":null,"reason":"evidence_update","revision":1,"schema_version":"BBREVISION1"}],"next_offset":null,"offset":0},"runtime":["historical-final/2503001"],"schema_version":"monitoring.v1","source_as_of":{"acquired_at_ns":"1789117280359665700","source_time":{"reason":"no_common_qualified_source_clock","status":"UNKNOWN","value":null},"valid_at":"per_object_source_cut"},"source_id":"lls-contract-fixture","source_instance":"order-b-01","source_sequence":"3","trust":{"independent_broker":"UNKNOWN","scope":"source_assertions_and_observer_derivations","status":"OBSERVED"}}