{"coverage":{"capture_status":"salvaged","reason":"existing_evidence_does_not_cover_all_runtime_boundaries","status":"INCOMPLETE"},"environment":"offline_fixture","freshness":{"derived_at":"2026-09-11T09:01:39.329583+00:00","reason":"copied_historical_evidence","source":"UNKNOWN"},"generated_at":"2026-09-11T09:01:39.329583+00:00","message_id":"mon1/c1ce03bebb5d83a4e5de4fd6f590a33f4126730c20d4666d9c2b5217c0e8836f","message_type":"monitoring.forensic_reference","payload":{"bytes":2453,"case_id":"case/952fbe14a9b7317ad689c6f0d5f70bab928853e5ecfb47c6a10f899f2ec14203","coverage":{"events":1,"session_completeness":"UNKNOWN","truncated":false},"retrieval":"operator_approved_transfer","sha256":"1a0447fabc5b97c3e3bf9f6d593741d46c6d50beb81eba2ad45cca76b0db376c"},"runtime":["historical-final/2503001"],"schema_version":"monitoring.v1","source_as_of":{"acquired_at_ns":"1789117280359665700","source_time":{"reason":"no_common_qualified_source_clock","status":"UNKNOWN","value":null},"valid_at":"per_object_source_cut"},"source_id":"lls-contract-fixture","source_instance":"main-01","source_sequence":"4","trust":{"independent_broker":"UNKNOWN","scope":"source_assertions_and_observer_derivations","status":"OBSERVED"}}